claim_id,status,sentence,sentence_found,evidence_paths,evidence_sha256,evidence_verified,gate_pass
configured_sparse_port_ambiguity_boundary,supported,"Terminal conductance is strongly associated with integrated conductivity, yet port-only recovery of the complete configured hidden fields fails.",true,outputs/tables/pinn_identifiability_summary.json;outputs/tables/pinn_inverse_v0_ablation_summary.json,B50D1CCD32BE0A35F1D17683871746FD0EECE171DDF8C6DC0DD7EEB139106D34;19061ED8EEA2F83AF1439435E55C8FF5AF7A937BD85B449CCE769E7B9C27FE2E,true,true
calibration_gated_effective_heat_loss_recovery,qualified_supported,"With microphysics fixed and switching temperature T_sw calibrated or tightly bounded, continuous off-grid, noise, observation-count, and simulator-backed audits support conditional recovery of gamma_sub.",true,outputs/tables/gamma_sub_continuous_refinement_summary.json;outputs/tables/gamma_sub_tsw_confounding_phase_map_summary.json,AC4DBEE30D0A6C7C969DEF2E8EA5EAC43E5C959813D423D9A253F5C63B436C00;278A06B63D7D3B1B3EA1558E776E66891F50822015C8776BC1449A85945A4C48,true,true
calibration_dominates_protocol,qualified_supported,"A calibration--protocol disentanglement audit shows that calibration supplies nearly all of the tested gain; protocol variation is a secondary robustness modifier.",true,outputs/tables/gamma_sub_calibration_protocol_disentanglement_summary.json,F6537573D1795720CAA0B1A2F7BD828CA03D30DB4BCA4D70402960C330BF9397,true,true
configured_tolerance_spotcheck,qualified_supported,"The 270-case simulator-backed spot audit supports the configured response-surface transition near the 0.1 K calibration-error marker.",true,outputs/tables/gamma_sub_tsw_tolerance_ode_spotcheck_summary.json,D23F1C4FCE28C0DE60667CF229F02551C451FB8956D7A3D7EE088DE0A54FDA2C,true,true
complete_pinn_joint_gate_failure,failed_but_informative,"Every bounded trained route evaluated for this study misses at least one blocking gate.",true,outputs/tables/full_pinn_single_seed_mve_v1.json;outputs/tables/m33_mixed_flux_final_summary.json,AAF73F795713F8B9C39541D55C25600F374EECF0406C042E3449A659F583C5A9;B0F3F25E3C54AD0C6096382193557EEEDD1E928A5896D1D07A69B7353A834EE4,true,true
